 Is the MS-ISE program STEM certified?,"Yes, the MS-ISE program is a STEM program.
                     ",
How can I apply to the MS-ISE program?,"Visit Domestic Steps to Admission for details on the application process.
                     ",/graduateadmissions/want-to-apply/domestic-steps-to-admission/
I am an international student. How do I apply?,"Visit International Steps to Admission for details on the application process.
                     ",/graduateadmissions/want-to-apply/international-steps-to-admission/
What additional documents are needed to apply?,"The MS-ISE Program does not require any application document beyond the documents
                        required by GAPE.
                     ",
 What is the minimum requirement for GRE?,"6.5
                     ",
What is the minimum requirement for IELTS?,"80
                     ",
What is the minimum TOEFL requirement?,"No. However, they may be helpful for applicants whose grade-point average (GPA)
                        is lower than 3.0 (on a scale of 4).
                     ",
Are recommendation letters required?,"Please send all application documents to GAPE (not to the ISE Department).
                     ",
Where should I send documents?,"Please visitGAPEand read the content thoroughly before emailing questions. Deadlines, documents,
                        fees, and other details can be found on GAPE as well.
                     ",/graduateadmissions/
How can I get codes for classroom door locks?,"For ENG rooms 247, 285/7 and 189 contact Sandy Jacobs, 408-924-3806 or sandra.jacobs@sjsu.edu.

For rooms maintained by a department, please contact the department’s administrative assistant.

For ENG labs 333, 335, 337, 339, 390-394, 407, and IS 103—all full-time faculty and staff have lab access codes issued to them by ECS. Your department admin should have a copy of those codes, or you can contact Scott Pham, 408-924-4020 or scott.pham@sjsu.edu. Part-time faculty and TAs who teach in these labs should contact Sandy Jacobs, 408-924-3806 or sandra.jacobs@sjsu.edu for a temporary access code.",
How do I make a classroom change request?,"If you need to change the room your class is in, please contact your department administrative assistant to prepare and submit the necessary request forms.",
Who do I contact about one-time classroom reservations?,"If you need to make a one-time classroom reservation for your class or as a student club advisor, please contact your department administrative assistant to prepare and submit necessary request forms.",
Who do I contact about conference/event room reservations?,"Some departments have their own conference rooms. Please check with your department administrative assistant first. ENG 247 and 285/7 are available for faculty and staff to request by contacting Sandy Jacobs, 408-924-3806 or sandra.jacobs@sjsu.edu. Please contact Sandy at least 72 hours before the event to check for availability.",
How do I reserve the Engineering Auditorium (ENG 189)?,"For one-time, non-classroom usage of the Engineering Auditorium, contact Sandy Jacobs, 408-924-3806 or sandra.jacobs@sjsu.edu at least 72 hours before your event to check for availability. Only SJSU faculty and staff may request to use this room.",
Who do I contact about classroom internet connection?,Submit an iSupport request : https://isupport.sjsu.edu/engineering/Dashboard,
How can I get support for classroom computers or overhead projectors?,"Contact your department technician about malfunctioning computers or overhead projectors. For problems with the projectors in ENG 189 or 285/7 contact Lee Andersen, 408-924-4134 or lee.andersen@sjsu.edu.",
ow do I report a problem with Engineering room heating or air conditioning?,Place a service request on FD&O’s TMA website. FD&O will email you once your request has been approved for work. You can check on the status of your request on the site as well. Please let your department administrative assistant know that you’ve made the request.,
"How do I report an immediate facilities problem (e.g., water leak, backed-up plumbing, electrical problem)?","Call the FD&O help desk 408-924-1990. Be prepared to give your name, phone number, and the room number or building location of the problem.",
What is the required GPA to change my major to CMPE and SE?,"The department uses the Impacted Grade Point Averages (GPAs) for transfer students who have completed four course requirements as a basis for change of major. Students need to meet the Impacted GPA in “All College” GPA provided they have passed the four required courses. Also, they will be ranked based on the Impacted GPA on all STEM courses required in the major. The University publishes the impacted GPA annually, which is 2.6 for SE and 2.7 for CMPE for 2016",http://www.sjsu.edu/admissions/impaction/impactionresultstransfer/index.html
Which courses are required for change of major?,"The four required courses that need to be completed with a grade of “C” or better are the same as the supplemental courses for transfer students. These courses are:
CMPE: Math 30, Math 31, Physics 50, CMPE 30
SE: Math 30, Math 31, Physics 50, CS 46A.",http://engineering.sjsu.edu/students/future-students/transfer-requirements
Could you provide some clarifications in how to use the change of major formulas ?,"The first formula
(GPA) _ 150 + (CRS #1) _ 150+ (CRS #2) _ 150+ (CRS #3) _ 150 + (CRS #4) _ 150
 is the same as the one used for transfer students. It simply means that students should get the impacted GPA for all classes taken provided they have passed the four required courses.",
What are the other factors used in ranking the students?,"The department uses the number and strength of the STEM classes taken as well as the number of attempts. In addition, the total number of units taken, the number of units needed to  graduate in the new major and the SJSU Cumulative GPA will be considered.",
"I have just being admitted as a freshman or as a transfer student to SJSU but in a different major (including undeclared) , can I request a change of major to SE (or CMPE) right away?","No, you need to take courses at SJSU that are part of the major for at least one semester.",
 I am a current SJSU student and I want to change my major to SE (or CMPE) which classes should I take?,"You need first to complete the required courses listed above. Then in order to improve your chances to get to the major, you should take STEM classes required in the major. But you need to remember that getting to the major is not guaranteed even if you meet the requirements. So you need to explore other majors as well.",
Does the department intervine to assist students in enrolling in the classes needed for change of major?,Unfortunately no. The department has no control over how other departments manage enrollments in their classes. The only required CMPE course is CMPE 30 which is open to non-major students.,
Do I need a study plan to change my major to SE (or CMPE)?,No. The department is no longer using study plan for change of major.,
"One or more of the required classes  is full at SJSU, can I take it at a community college?","Yes, as long as they are articulated with SJSU and the grades will be posted at mySJSU at the time of the review.",
When can I apply for change of major and which documents are needed?,"The department starts reviewing applications twice a year: June 15 and January 15. The review process is expected to take about two weeks. So applicants need to submit their applications to the department office by these deadlines. The application consists of an unofficial SJSU transcript and the proper change of major form (either fewer than 90 units or 90 or more units),
http://www.sjsu.edu/registrar/students/change_of_major/index.html
The deprtment will inform the applicants once the review is complete.",
"I am an international student admitted to a different major, how can I change my major to SE (or CMPE)?",You still need to take courses at SJSU as described above. We follow the same procedure for all students.,
How can I get a list of GE course?,A list of required General Education courses can be found in the Catalog or on your MySJSU generate a MyProgress Report.,
"I completed all of my lower division GE and I have passed the WST. I currently have FEWER than 60 units completed and I would like to register for SJSU Studies (Areas R, S, V, & Z) courses requiring upper division standing, but MySJSU says I do not meet the requirements. How do I register for these courses?","Students who have been matriculated at SJSU for at least one semester, who have fewer than 60 units completed at the time of registration, and would like to register for SJSU Studies courses requiring upper division standing will need to file a petition. Students will need to submit the Petition to Enroll in SJSU Studies with Fewer Than 60 Units, obtain major advisor or Department Chair's signature before submitting the petition to Undergraduate Studies. If approved, students are eligible to enroll in SJSU Studies no earlier than the first day of classes. Enrollment is not guaranteed.",
What are SJSU Studies courses?,"SJSU Studies courses (Area R, S, V, & Z) are Advanced/Upper Division GE courses taken after the Writing Skills Test (WST) is passed. Students must have at least sixty earned units and passed the WST in order to take any SJSU Studies Course.",
Can you waived the 100W course? ,"The 100W course can be waived for a few major if a student scored 11 or 12 on their WST, completed GWAR requirement at another CSU school or file a Written Communication II petition and it was approved.",
How can I find out if the course I took at another college transfers to SJSU?,"Students can visit SJSU Articulation for complete listings of articulated courses from other colleges. In addition, students may also visit Assist for California Community College.",
"I took a lower division (LD) GE course at a Community College or 4 year school and it did not transfer to SJSU as GE, but I would like to petition the course for LD GE credit, what form would I use? ",Students who have taken a course that satisfies a specific GE requirement(s) but is not currently articulated will need to file CORE GE Equivalent Course petition.,
"I took an American Institutions (US 1, US 2, US3) course at another college, but the course did not articulate, what form should I use? ",Students should use the American Institutions Equivalent Course petition. Student will need to submit the petition to the Chair of History or Political Science for review before submitting the petition to Undergraduate Studies.,
"I took an upper division GE course at another CSU, but the course did not articulate when I transferred, what form should I use?",Students should use the SJSU Studies Equivalent Course petition. Student will need to submit this petition to their college advising center for review before submitting it to Undergraduate Studies.,
Can I take courses at another college while attending SJSU? ,"Yes, students can take courses at other colleges while matriculated at SJSU. Student should meet with a SJSU advisor before taking such courses.",
How do I transfer credits from another institution to SJSU? ,Submit Official Transcripts to the Admissions Office from the other school. Admissions is located in the first floor of the Student Services Center.,
I failed a course at SJSU can I retake it at a Community College?,"Yes, students can courses at other schools. Students will not received Grade Forgiveness if the course was taken at another school, both attempts need to be from the same institution. ",
Do I have to take the Writing Skills Test? ,"All CSU students must meet the California Graduate Writing Assessment Requirement (GWAR) as part of their degree requirements. At SJSU, for first baccalaureate students, successful completion of the GWAR means: 1) passing the WST and then 2) passing 100W. At SJSU, all first baccalaureate students must pass the WST as a pre-requisite for 100W and SJSU Studies (Advanced GE) courses (Areas R, S, V, and Z).",
What happens to me if I do not pass the WST? ,"You will not be able to take the SJSU Studies courses. If you fail the WST once, it is recommended to take LLD 100A or ENGL 100A. Failure to pass the WST will delay your graduation.  You can only take your required 100W course after you pass the WST.  Many majors require the successful completion of 100W course before taking any upper division coursework in the major.",
When should I take the WST?,You should take the WST immediately after successfully completing GE Area A3 or second semester composition course.,
Do I have to be Reinstated to the major I was disqualified from?,"Students can be reinstated into a particular major.  Students may request their original SJSU or another major, based on their transfer work.  It will be up to the department to reinstate a student into a particular major.  In some cases, it might be more appropriate to reinstate a student to Undeclared in Academic Advising & Retention Services.",
Do I need to complete a Reinstatement petition even though I was not disqualified from SJSU?,"Students who ""stopped out"" on Probation or in Good Standing only need the FSR petition and not a Reinstatement petition.  ",
"I completed my Reinstatement petition, is there any other form I need to complete? ","Yes, an approved Reinstatement petition is a prerequisite for submitting and approved Re-Admission Petition as a Former Student Returning to SJSU (FSR). ",
When do I have to reapply to SJSU? ,Students need to reapply to SJSU if they stop attending SJSU for two or more consecutive semester or following an approved reinstatement.,
"My Reinstatement and FSR form were approved, I have over 60 unit but I have not completed my basic four skills (Area A1, A2, A3, & B4) requirement. Can I apply for admissions through CAL STATE APPLY? ","In order to be eligible for “Readmission after Disqualification”, students must have satisfied GE Areas A1, A2, A3, and B4 (also known as the basic four skills), earned 60 or more units, have an All College GPA of 2.0 or better, must be reinstated if in DQ academic standing and have an approved FSR by it's deadline (Jan. 15 for next Fall (re)admissions; Sep. 30 for next Spring (re)admissions. ",
What GPA determines my Academic Standing?,"SJSU Cum GPA determines Academic Standing (e.g., Good Standing, Probation, or DQ); All College GPA determines (re)admission.  ",
I walked does that mean I graduated?,Participating in a convocation ceremony DOES NOT equal to graduating from SJSU. Only when a degree is confirmed and posted on a student's record does a student official graduate from SJSU.,
How will I be notified if I have officially graduated? ,Students can see their status by viewing their Unofficial Transcript. Official proof of graduation is the student's official transcript. Only when a degree is confirmed and posted on a student's record does a student official graduate from SJSU.,
I completed all major and University requirements and believed that I graduated but my records shows as not graduated. Whom should I contact regarding this?,"Student should contact the Registrar’s Office to verify they have completed all the requirements. If all requirements were complete by the expected graduation date, student's degree will be posted. Otherwise, a student will need to file a Backdate of Degree form.",
How do I change/add my major/minor? ,Students will need to complete and file a request for a Change of Major or Minor from the Registrar’s Office. Students will need to obtain signatures from the desired major or minor department before submitting the completed form to the Registrar’s Office.,
"My request to change/add a major/minor was denied, what could I do? ",Students can appeal such decisions under Presidential Directive 2009-05. Petition can be found under UGS forms and petitions page.,
How do I drop my minor? ,Student needs only to write a statement wishing to drop minor. Statement should be signed by student and dropped off to the Registrar's Office.,
Can undergraduate students apply for graduation and graduate from Open University (OU) status?,"Yes, it is possible to apply for graduation and complete degree requirements through Open University (OU) without ever getting (re)admitted UNLESS there are supervised courses remaining because OU students may not enroll in supervised courses.  Applications for graduation are only accepted from students on Probation or in Good Standing (not from DQ'd students) and must have been matriculated at SJSU for at least one semester. Students in ""Disqualified"" academic standing must be reinstated before applying for graduation.",
"I have eared more than 24 Open University units, what can I do to have them count towards by degree requirements?","CSU Rules permit a maximum of 24 UE through OU to count toward the minium 120 UE needed for a baccalaureate degree.  But, there is no limit on the number of OU units that can be approved by petition; if all other requirements for graduation have been met, then the Associate Dean of UGS or the Registrar can approved excess units needed to satisfy residency, baccalaureate requirements, or upper division credit.  ",
What is a Special Major? ,The Special Major is an individually designed course of study leading to a BA or BS degree when academic professional aims are not adequately accommodated by existing university-level SJSU undergraduate degree majors. The purpose of the Special Major is to give a student with a definite educational objective the opportunity to accomplish that goal. The Special Major Guidelines provide specific information about how to apply for the program.,
"What is considered ""Good Academic Standing?""","SJSU requires at least a GPA is 2.0 or more. However, certain majors may require a higher GPA minimum to remain in the respective major.",
When would I be considered to be on academic probation?,"Upon conclusion of a term in which a student’s SJSU cumulative GPA becomes lower than 2.0, they will be placed on academic probation.",
When would I be removed from academic probation?,Upon conclusion of a term in which a student's SJSU cumulative GPA rises to at least 2.0,
"What's the difference between my SJSU GPA and my ""all college"" GPA?","SJSU GPA is calculated strictly SJSU while all college GPA is cumulative from all colleges, such as SJSU, community colleges, 4 year institutions.",
Can I graduate while on probation?,"No. A student may not graduate while being classified as on-probation, regardless of their progress on all of their other requirements. For example, if you have finished all of your GE, major, and (if applicable) minor requirements, but currently have an SJSU cumulative GPA of 1.8, you will not be permitted to graduate.",
"I was placed on administrative-academic probation, or probation within my major. Are there different types of probation?","There are three types of probation: academic probation, administrative-academic probation, and probation within a major.",
When should I apply for graduation?,It is typically preferable to apply for graduation when you have reached the minimum threshold of 90 units. You should meet your major advisor and a GE advisor to ensure that you are eligible for graduation.,
How do I apply for graduation?,"To file for graduation, a student must submit an application for graduation, which can be found here. For a walkthrough, follow here for the H&A Student Success Center's outline of the process.",http://www.sjsu.edu/registrar/docs/grad_app.pdf
How to change my graduation date?,You will the required signatures from your major advisor and fill out the details on the graduation date change form found here. Please note that you will be required to pay a non-refundable $10 fee for changing your graduation date.,http://www.sjsu.edu/registrar/docs/grad_change.pdf
When’s my enrollment date?,Navigate to your MYSJSU account and click the enrollment date tab on the right hand side of the site.,
How do I drop a class?,"Access your class via MySJSU, and proceed to your enrollment tab. Specify the term you are taking the class for, click the drop tab and select the class you wish to drop. Student may only drop classes without a W before the drop deadline. If you are dropping a class after the deadline, refer here.",http://www.sjsu.edu/aars/policies/latedrops/
Does the waitlist carry over on the first day of instruction?,"The waitlist only applies to advanced registration, and does not carry over to the first day of class. To register for a class on the first day of instruction, you must contact the instructor of the course directly.",
Am I automatically dropped after first day or second day of class if I don’t attend?,"No. It is the student’s responsibility, not the responsibility of the professor to drop the class if they do not plan to attend.",
"How many units do I need to be considered ""full-time?""",Full-time undergraduate students are considered students that are enrolled in 12.0 or more units in the current term. Refer to the Office of the Registar's chart on enrollment status.,
How to apply for leave of absence?,Students are allowed to be absent and not register for classes for one semester with no documentations required. Students planning to leave for two or more semesters will be required to fill out a Leave of Absence Petition. Students petitioning for leave through this method will be allowed a maximum of four semesters on-leave. A Leave Request must be submitted prior to the first semester that the student intends to be absent.,
How does grade forgiveness work?,"Grade forgiveness is permitted only in courses where the grade earned was lower than a ""C,"" or others such as ""WU,"" or ""IC."" ""NC,""  and courses where the grade received was the result of documented academic dishonesty is not eligible for grade forgiveness. In addition, the prior grade earned will remain on the transcript, and grade forgiveness that results in a higher GPA will not remove a prior academic standing, such as probation or disqualification.",
How do I transfer my credits to SJSU from an inside institution?,"Contact the school which you wish to transfer courses from and request them to send a transcript to SJSU. If you do not have transcripts on file with SJSU that verify the courses you wish to transfer, you need to send original transcripts to GAPE",
Can I take community college courses while I'm here at SJSU?,Yes. Students may be enrolled and attending classes concurrently in a community college while attending classes at SJSU.,
How many units can I transfer to SJSU?,"Students may transfer up to 70 units outside of SJSU to SJSU from a 2-year institution, like a community college. Students may transfer an unlimited amount of units from a 4-year institution, like another CSU, UC, or other private 4-year university.",
How do I apply for financial aid?,Complete the Free Application for Federal Student Aid (FAFSA) or the CA Dream Act Application. The priority filing deadline date is March 2. The school code for SJSU is 001155.,
Do I have to be enrolled full-time to receive financial aid?,"Most aid requires at least half-time enrollment (6 units for undergrad/post-baccalaureate/credential students, and 4 units for graduate students). However, because financial aid is awarded based on full-time enrollment, students must notify the Financial Aid and Scholarship Office if enrolled less than full-time by submitting the Student Information Update Form.",
"I completed a FAFSA or Dream Act application, what is the next step?",Periodically view your MySJSU for document(s) that will appear on the To Do List. View Seven Steps to Financial Aid for details on the financial aid process at SJSU.,
Can I fax or email the financial aid documents?,The Financial Aid and Scholarship Office cannot accept faxed or emailed documents. Documents must be submitted in person or mailed. ,
When will I receive an award notification?,"The evaluation process begins when all required financial aid documents are received. Check your To Do items to see if additional documentation is needed. The evaluation process can take approximately 4-8 weeks, depending on the volume of applications received. When the evaluation process is completed, an award notification will be sent to your MySJSU.",
I completed the Dream Act application. What am I eligible to receive?,"You may qualify for state aid, such as Cal Grant, State University Grant, and EOP grant. For additional grant criteria, view types of aid.",
Do I qualify for the Dream Act?,"To qualify, you must be considered as an AB540 student. View CSAC for additional application criteria.",
What is a tuition fee deferral?,The tuition fee deferral protects course enrollment and delays the payment of tuition fees. The tuition fee deferral is temporary and is removed at the beginning of the semester. The purpose of the tuition fee deferral is to allow financial aid to disburse and apply towards fees.,
How do I get a tuition fee deferral?,Tuition fee deferrals are automatically assigned to a student's MySJSU once all requested financial aid documents are received and file noted as complete. View Important Announcements and Deadline Dates for document submission deadline. ,
Does the tuition fee deferral apply to housing fees?,The financial aid tuition fee deferral does not defer housing fees. Students should contact a University Housing Services representative for payment information.,
