How late can I add or drop a class without penalty?,Courses may be dropped without penalty during the first fourteen days of the semester and added for the first 21 days. See the Calendar section of the university website www.sjsu.edu/provost/academic_affairs/resources/academic_calendars/ for exact dates and deadlines. Courses dropped during this initial period will not appear on the student's transcript.,
"If I drop a class now, can I enroll in it next semester?","Yes, you can enroll in the class by the same process as used this semester.",
I enrolled in both CMPE 180D and CMPE 200 or 240 but then failed the Digital Design and Microprocessor test. Will I be penalized if I drop CMPE 200 or 240 after the semester begins?,"This is a less frequent problem now that we generally accept new students only with the equivalent of CMPE 180D in their bachelor’s work and, therefore, they do not have the CMPE 180D condition.  But should this happen, CMPE 180D should be taken, but CMPE 200 and 240 cannot be taken. The same is true of CMPE 180A and C as prerequisites for CMPE 220.  Courses may be added or dropped without penalty before the Add Deadline and Drop Deadline, respectively, so it is imperative that the core class be dropped via MySJSU before the deadline if the challenge exam is not passed. A student with admission conditions can enroll in graduate classes and also CMPE 180A, C, and D in the first semester in the master’s program. However, drop a condition course immediately after receiving a passing result in the pertinent challenge exam. For refund and pro-rata charges that will occur after the Drop Deadline, refer to http://www.sjsu.edu/bursar/payment_refunds/.",
When should I establish or update my Plan (Program) of Study?,"It is not required to file a Plan of Study until applying for a CPT, filing a candidacy form, or being on probation. It is, however, helpful when seeking advising from the department or Graduate Advisor.",
Can I transfer undergraduate units received at SJSU?,"ou can transfer a graduate course taken when you were a SJSU undergraduate senior student, but there are several restrictions. The course must not be listed on your undergraduate major form and thus must not have been used to satisfy any requirements for the bachelor’s degree.",
Can I transfer graduate credits from extension or Open University courses of other universities?,No,
Can I transfer graduate credits from non-U.S. institutions?,No,
"Will a transfer course be counted as a core, specialization, or elective course?",It could be counted in place of any to which it is equivalent.,
When can I request a transfer of courses?,"After a semester begins, you can submit a Transfer Non-SJSU or Open University Course Request Form for each course you’d like to transfer. You must submit the request form with all supporting documents to the department office. The documents required include a syllabus from the course taken and an unofficial or official transcript showing the date taken, number of units/credits, and the grade earned. Minima of a “B” grade and 3 semester units/credits (or their equivalent) are required, and the course must have been taken recently enough that it will not expire by the seven-year limit at the point of graduating from the MS-CMPE program. The MS-CMPE Graduate Advisor will consult with the professors possessing the subject knowledge to decide whether to approve the request or not.",
Can I take off-campus courses as part of my degree program?,Off-campus courses cannot be used for the on-campus MS-CMPE degree program.,
I am working in the Silicon Valley. Is it feasible for me to attend classes?,Almost all single-section CMPE graduate courses are offered after 6:00 p.m.,
What are the differences between a master’s project and master’s thesis?,"A thesis has more rigid requirements for content and reporting style. A project in CMPE is a group affair over the course of two semesters. A thesis, a more in-depth and lengthy document, is an individual affair and often involves an additional semester or two of research, so it is advisable to start the research in the second semester after matriculation (or even the first). The submission date to the Office of Graduate Studies, which must approve theses but not projects, is relatively early in the semester, meaning half of the semester is lost in the thesis-preparation process. A project-track student must enroll in CMPE 295A and CMPE 295B in two consecutive semesters; a thesis-track student must enroll in CMPE 299A and CMPE 299B in two consecutive semesters. Summer enrollments are optional and depend on agreements with and availability of the supervising faculty member and other members of the research group.",
How can I find a project or thesis advisor and decide on my project or thesis topic?,"Your project/thesis topic must be closely related to your specialization. Your thesis or project advisor must be an SJSU Computer Engineering professor with expertise in the area of your specialization. To have a faculty member serve as your project or thesis supervisor, you must approach professors to inquire about joining their research team.",
Will the classes I take to satisfy my admission conditions be counted as part of the required 9 units for students on an F-1 visa?,Yes,
Will CMPE 298i for CPTs be counted as part of the required 9 units for students on an F-1 visa?,Yes,
Are there any requirements for taking CMPE 294?,The only requirement for taking CMPE 294 is to be a registered Computer Engineering Department graduate student.,
"If I take CMPE 294 and CMPE 295A concurrently, what is the consequence if I fail CMPE 294?","The completion of GWAR (e.g., receiving a passing grade in CMPE 294 or ENGR  200W) is required to obtain a passing grade in CMPE 295A or CMPE 299A. At the end of the semester, a student who has not completed GWAR will receive a failing CMPE 295A or CMPE 299A grade and must enroll in CMPE 295A or CMPE 299A again, restarting the project or thesis.",
"If I cannot complete CMPE 295B or CMPE 299B this semester, what should I do?","A student who is unable to complete CMPE 295B or CMPE 299B due to unforeseen circumstances beyond his or her control will be given a grade of “I” (Incomplete) or “RP” (Report in Progress) and will need to register for CMPE or UNVS 1290R for a one-semester extension. Please see the Graduate Advisor to arrange for a registration appointment for CMPE or UNVS 1290R, as it will not automatically be available on MySJSU. Documentation of the extenuating circumstance is needed to be given this privilege. A student who fails to complete the requirements of CMPE 295A or 299B without adequate documentation of circumstances beyond his or her control will have to repeat the class in a subsequent semester.",
"I’ve heard that the program is being changed to 33 units.  When will that happen, and what are the consequences for new and existing students?","The conversion of the MS-CMPE (and MSSE) program to 33 units will occur with the start of the Fall 2020 semester. Those who entered the program before that time will not be affected at all; their degrees will still require 30 units plus satisfaction of the GWAR. New master’s students will also be required to take 30 units plus GWAR, but if they secure a waiver for GWAR, they will have to choose an elective to take to make up the units. If a waiver is obtained by existing students, the GWAR class is not taken and the units do not need to be made up, so no elective class would be required in place of the GWAR class. Unless a GWAR waiver is involved, there is no difference between the two master’s programs.",
I was admitted into a different department but want to transfer into the MS-CMPE program. Can I do that?,The MS-CMPE program no longer takes transfers from other departments.,
I'm entering as a freshman.  What do I do?,"1. Make sure to attend frosh orientation, as described in the material sent to you by the university upon your acceptance.
2. Strongly consider enrolling for Science 2 in your first semester. 
3. At the beginning of the semester, meet with the College of Science Advising Center (COSAC) advisor, as described on the CS department advising web site.
4. If you are considering Calculus I in your first semester, be sure that you are registered to take the Calculus Placement Exam (or are exempt from it). 
5. Become familiar with the Schedule of Classes, the university catalog, and the blue sheet and sample program.
6. Also see the answer to the question about the computing devices you will need as an SJSU CS major.",
 Does the department participate in the Four-Year Graduation Pledge Program?,"Yes, although the conditions for BSCS students are very strict due to the large number of required courses in the program. In addition to all university requirements, you must get grades of C- or better in all courses, not repeat any courses, be ready to start calculus in your first semester, and stick with the sample program publicized by the department unless your advisor has approved a deviation. ",
What is Science 2?  What is Science 90T?,"Science 2 (Sci 002) is a course designed to improve retention rates in science and engineering and poor student preparation in general.  Effective Fall 2007, it is a permitted General Education course under Area E. It is an appropriate course for a substantial proportion of frosh CS majors.  Since the course is a General Education course, you can count it toward graduation (if you have not already taken another Area E course).",
Does the first computer science course (CS 46A) assume any background in computing?,"Officially, no. However, a number of students in the past have attempted to take the course with little experience with computing. Many of these students have not succeeded.",
What is the STAR Act?  What is SB 1440?  What is C-ID?  What is an AS-T degree?,"SB 1440, the STAR act, is a California law designed to improve the interface between community college programs and CSU degree programs. C-ID is a course numbering system used in the implementation of this act. Students with an appropriate AS degree (an ""AS degree for transfer"", or ""AS-T degree"", in computer science) are automatically exempt from certain BSCS requirements.",
I'm considering entering as a transfer student.  What do I do?,"For general information about transferring to SJSU, see the university web pages on Transfer Admission Requirements and SJSU Undergraduate Degrees and Impaction.  Pay special attention to the section on transferring as a lower-division student if this is relevant to you, since this kind of transfers may not be possible in a given semester.  Impaction is important since it is likely to result in a minimum GPA requirement for transfer, which you can check by clicking on the impaction link.",http://info.sjsu.edu/static/admission/undergrad-admission.html
"Can lower-division courses I have taken at other institutions count toward the BSCS degree?  If so, will they be recorded on MySJSU?","In most cases, lower-division courses that are substantially similar to Math or CS courses at SJSU can be used to satisfy major requirements.  In particular, students with an Associate Degree for Transfer in CS are guaranteed BSCS credit for Math 30, 31, and 42; Phys 50 and 51; and CS 46A, 46B, and 47.",
Can I use courses taken elsewhere to satisfy upper-division BSCS requirements at SJSU?,"1.Upper-division courses that were taken before entering the CS major, and that closely match SJSU courses allowable for that major, may be used to waive the corresponding SJSU BSCS requirements.
2. A lower division linear algebra course is likely to be accepted for waiver of the Math 129A requirement. A combined course in linear algebra and differential equations of at least 5 semester units is likely to be accepted for waiver of the Math 129A requirement.
3. For current CS majors, waiver of upper-division courses by coursework taken elsewhere while a student is a CS major at SJSU must be approved IN ADVANCE by the department.  This includes courses taken at SJSU outside the CS department.  Check with the CS department office (MH 208) for particulars.
4. In rare cases, a lower-division course taken at a topnotch institution before a student enters the CS major at SJSU may be used to waive an upper-division BSCS requirement at SJSU.",
How can I change my major to computer science?,"Entry into the CS major at SJSU is now competitive.  The rules for applying to change your major to computer science are given on the CS department's web site.  They apply to students seeking a double major and students returning who were not in good standing in the major or the university when they left, as well as to students seeking to change their only major.",https://www.sjsu.edu/cs/practicalities/major-change/
How do I go about getting a minor in computer science?  ,"You must meet the following requirements before you can declare a CS minor
- SJSU Cumulative GPA of 2.7 or better.
- Complete the following courses with a B- or better:
     A. Math 42.
     B. CS 46A (or equivalent course in Java).",
What is SJSU Studies?,"SJSU Studies is the advanced portion of General Education.  It consists of four requirements -- one course each from Areas R, S, V, and Z. Two requirements are met by BSCS Support Courses -- the Area Z requirement is met by CS 100W  (Technical Writing Workshop) and the Area V requirement is met by Phil 134 (Computers, Ethics, and Society).",
I don't understand the BSCS science requirements,"For the requirements in effect for Fall 2014 or later, 14 units of science coursework must be taken from a specified list, including 5 units from a sublist of this list.  If you don't count any of these 5 units toward GE, then you may satisfy the remaining 9 units with GE Areas B1/B3, B2, and R. ",
How do I know whether I have satisfied the language prerequisite for CS 46B (or 49J or 146 or 151)?,"If you took CS 46A at SJSU, you have satisfied the language prerequisite for CS 46B.  If you took CS 46B at SJSU, you have satisfied the language prerequisite for both CS 146 and 151.  If you took CS 49J at SJSU, you have satisfied the language prerequisite for both CS 146 and CS 151.  If you took CS 46A at SJSU, you should not take CS 49J.",
Does the department offer short courses on current computing topics?  Is that what CS 85 and CS 185 are?,"In a sense, yes. Sections of these two courses vary in their content vary from 1 to 3 units. One-unit sections (numbered CS 85A or CS 185A) will be graded credit/no credit. Two-unit sections (numbered CS 85B or CS 185B) and three-unit sections (numbered CS 85C or CS 185C) will use letter grades.
Most CS 85 and CS 185 courses will count as CS electives.  Normally only one BSCS elective may be satisfied in this way.  However courses such as Mobile Device Development that have become permanent courses under a different number are not subject to this limitation.",
"What is a ""deep"" course?  If I chose a ""B"" course for the deep course but have changed my mind, how can I complete my graduation requirements?  What if I already took the corresponding ""A"" course?","A ""deep course"" is just one that can be used as the last required computer science course in the BSCS requirements.  For Fall 2015 the deep courses are CS 116B, 123B, 153, 157B, 158B, 161, 167B, and 167C.
You can change your mind about what deep course to take just as you can change your mind about an elective.  How you do this will depend in part on whether you have taken another ""A"" course, whether you have room in your electives to take another ""A"" course, and whether you are willing to take another ""A"" course even though you have completed your electives.",
Can I make substitutions for courses in the BSCS program?,"In some cases, yes, with approval from an advisor (subject to approval by the department's undergraduate coordinator).",
When and how can I drop classes?  When and how can I add classes?,"University policy S09-7 states that for a student to drop after the first two weeks, there must be serious and compelling reasons.  In the last 20% of the semester, exceptions are granted only if these serious and compelling reasons are beyond your control.",
"Is there a way of retaking a course to improve my grade?  If so, how does it work?","SJSU has a provision for ""grade forgiveness"", allowing undergraduate students to retake an undergraduate course to improve their grade in the course.  Constraints on the use of grade forgiveness can be found in the university catalog.",
I think I already know the material in a particular course.  Can I get credit by examination?,"The department currently allows credit by examination only for CS 46A, and only by taking the Computer Science AP Exam, as required by the new university policy for credit by examination.",
Can I use courses taken in the College of Engineering to satisfy BSCS requirements?,"In many cases, yes, if you took the course while you were an engineering major.  For example, Engr 100W may be used to replace CS 100W if you took the former course while an engineering major. However note that when it comes to SJSU Studies, BSCS students may count Engr 100W toward Area Z only, and not toward Area R.",
Does the department offer credit for extension courses taken elsewhere?  For work experience?,"Since extension courses vary so widely and offerings change so frequently, it is not possible for us to evaluate the vast number of extension and online courses being offered. Therefore, it is our policy not to accept extension courses as equivalent to SJSU courses, unless the course is accepted in a university's CS degree program.",
Does the department offer any certificate programs?,"The department now offers a Basic Certificate in Cyber Security Fundamentals.  All of the courses in the certificate program may count toward the B.S. in Computer Science.  There are several lower-division prerequisites for the courses in the program, so it will be difficult to complete except for majors in Computer Science or a related area.",
What CS offerings are available in software engineering?,The Computer Science department now offers an undergraduate software project course (CS 161) along with the longstanding undergraduate course in software engineering (CS 160) and the graduate software project course (CS 240).,
Are there internship or co-op programs for BSCS students?,"Yes.  The CS department has an internship program, and BSCS students are eligible for the math department's Center for Applied Mathematics and Computer Science (CAMCOS).  The SJSU Career Center also provides support for seeking and profiting from internship opportunities.",
What computing devices will I need as a Computer Science major?,"You will need a device with internet connectivity so that you can access the university's wireless network.  The network is available in every classroom.  For account or password information about the network, check the SJSUOne web site.",
Are there jobs available through the CS department?,"A very few jobs are available.  Check with the department office or see the question on financial assistance in the FAQ for the MS program. Keep in mind that this discussion refers to aid available through the department, rather than through the university.  Also, teaching associate positions are unlikely to be offered to undergraduates.",
Is there any software that is available at special rates to CS students?,"The CS Club web site often has links to such software, and to other resources as well.",http://csclubsjsu.com/
What is an advising hold?  What is a probation hold?  Why do I have one?    How can I get it removed?,"An advising hold is a mechanism by which students are prevented from registering for classes until they have seen an advisor.  For every semester's registration, advising holds are now placed on all Computer Science majors, graduate and undergraduate students alike. Probation holds are registration holds for students on academic probation.
To remove either kind of hold, see the advisor given by the instructions at the CS department web site.  It is important to remove advising holds before the end of each semester, since you cannot count on your advisor being on campus between semesters.",
May I count a newly created elective or deep course toward the BSCS? Must I follow a newly imposed prerequisite?,"The answer to the first question is yes, subject to any explicit restrictions placed on doing so.  That is, if you are following the BSCS requirements as of a certain date, it doesn't matter whether the course was an elective or a deep course was permitted on that date. For example, if you were already a CS major when CS 167B (DB2 Application Development for z/OS) became a deep course, and you are following the BSCS requirements that were in effect when you became a CS major, you can still use CS 167B as a deep course.  The same applies to CS 161 (Software Project), which was another late addition to the list of deep courses.  And the same applies to newly created elective courses such as CS 167A (DB2 Fundamentals for z/OS).",
Who should I see if I am having trouble with department or university rules and regulations?  Who should I see for other types of assistance?,"For most CS issues, you should start with the appropriate advisor, as given on the CS advising web page.",https://www.sjsu.edu/cs/practicalities/cs-advising/
How do I apply for graduation as a CS student?,"To apply for graduation, you must follow the steps below:
1. Register and attend a Computer Science Graduation Workshop.  At the workshop, you will be given a 'starter' major form listing the courses that you have completed and the courses that are in progress. 
2. On the major form, fill in the courses that you plan to take to fulfill the outstanding requirements. List the semester you intend to take each course.  Make sure you check the prerequisites and the the course offering patterns. 
3. Meet with your advisor so that they review your major form and approve it.
4. Submit the major form to the CS department office (MH 208) to get the department approval.
5. Once your major form is approved, you will get an email from the CS Undergraduate Coordinator with a copy of your approved major form attached.  Your major form will be sent electronically to the registrar.
6. Apply for graduation online via MySJSU.  Here's an Online Graduation Application tutorial.
7. After your application is processed by the registrar, you will receive a graduation worksheet via your preferred email address. PLEASE CAREFULLY REVIEW YOUR GRADUATION WORKSHEET and make sure you complete all GE and major courses listed.",http://www.sjsu.edu/registrar/graduation/index.php?utm_source=registrar&utm_medium=301&utm_campaign=redirect_registrar_graduation
What is a graduating senior? What is a graduation worksheet? What is a graduation checklist? Why are these important?,"By university policy, graduating seniors are to be given priority in registration for courses that they need to take in order to graduate on time. In particular, they are to be given priority over other students for adding courses. In recent semesters, the registrar's office has been providing special cards to graduating seniors that they may use to identify themselves to instructors.",
 I'm trying to fill out my major form.  What do I do on the form about courses I still need to take?,"You should include these courses on the form.  List the semester you intend to take them.
In the case of electives, you should make your best guess about which electives you will be taking, and when you will be taking them, and put these guesses on the form.
If you end up taking different courses than the ones you indicated on the form, you need to fill out a course substitution form reflecting the change.  If you are also changing your catalog rights, you need to fill out an appropriate form.  These forms are much simpler to fill out than the major form.",
"I've already turned in my major (or minor) form, but I will not be taking one or more of the courses listed on the form. What do I need to do?","This is a fairly common occurrence. Of course you will need to replace the courses you won't be taking with other courses, and the new set of courses still has to satisfy some set of major or minor requirements that you are entitled to use. A simple form called the Major/Minor Course Substitution Form is used to amend a major (or minor) form. You can download the form from the records office web site.  You don't need to see an advisor or the undergraduate coordinator.",
What are the requirements for graduation with honors?,"The requirements for graduation with honors are described in the department's section of the university catalog.   These are departmental honors, in the sense of the university catalog (follow the Undergraduate Information and Requirements | Honors links), as distinct from university honors at graduation (follow the same links).",
Is it difficult for CS majors to get a minor in another field? ,"With one exception, minors for CS majors require considerable extra coursework, since the BS program in CS has little or no room for free electives.  This exception is the minor in mathematics.  The math minor requires 18 units, including Calculus 1, Calculus 2, and 9 upper-division units in mathematics courses.",
